{
  "schema_version": 1,
  "updated_at": "2026-10-22",
  "updated_by": "codex",
  "primary_code_to_label": {
    "01": "Formal, Information and Computational Sciences",
    "01.04": "General ASD Methods without Concrete Object Experiments",
    "02": "Physics, Astronomy and Cosmic Sciences",
    "03": "Chemical Sciences",
    "04": "Materials Science",
    "05": "Earth and Environmental Sciences",
    "06": "Life Sciences",
    "07": "Medical and Health Sciences",
    "08": "Agricultural, Food, Forestry, Animal and Fishery Sciences",
    "09": "Engineering and Industrial Technology Sciences",
    "10": "Aerospace, Marine and Transportation Sciences",
    "11": "Social, Behavioral, Economic and Knowledge System Sciences"
  },
  "secondary_code_to_label": {
    "01.01": "Legacy secondary filing term 01.01",
    "01.02": "Legacy secondary filing term 01.02",
    "01.03": "Legacy secondary filing term 01.03",
    "01.04": "Legacy secondary filing term 01.04",
    "02.01": "Legacy secondary filing term 02.01",
    "02.02": "Legacy secondary filing term 02.02",
    "03.01": "化学总论与化学方法",
    "03.02": "基础化学",
    "03.03": "合成、反应与催化",
    "03.04": "分子设计与化学空间探索",
    "04.01": "材料基础",
    "04.02": "结构材料与无机材料",
    "04.03": "软物质与功能材料",
    "04.04": "能源、电子与器件材料",
    "05.01": "Legacy secondary filing term 05.01",
    "05.02": "Legacy secondary filing term 05.02",
    "05.03": "Legacy secondary filing term 05.03",
    "05.04": "Legacy secondary filing term 05.04",
    "06.01": "生物学基础",
    "06.02": "生物类群科学",
    "06.03": "生物技术相关科学",
    "07.01": "医学基础",
    "07.02": "临床医学",
    "07.03": "公共卫生与健康科学",
    "07.04": "药学与生物医药",
    "08.01": "Legacy secondary filing term 08.01",
    "08.03": "动物科学",
    "08.05": "Legacy secondary filing term 08.05",
    "09.01": "Legacy secondary filing term 09.01",
    "09.02": "Legacy secondary filing term 09.02",
    "09.03": "Legacy secondary filing term 09.03",
    "09.04": "Legacy secondary filing term 09.04",
    "09.05": "Legacy secondary filing term 09.05",
    "09.06": "Legacy secondary filing term 09.06",
    "09.08": "材料与器件工程",
    "10.02": "Legacy secondary filing term 10.02",
    "10.03": "海洋工程",
    "10.04": "Legacy secondary filing term 10.04",
    "11.01": "Legacy secondary filing term 11.01",
    "11.02": "Legacy secondary filing term 11.02",
    "11.03": "Legacy secondary filing term 11.03",
    "11.04": "Legacy secondary filing term 11.04",
    "11.06": "人类学与考古学",
    "11.07": "Legacy secondary filing term 11.07",
    "10.01": "航空科学"
  },
  "label_to_primary_code": {
    "Formal, Information and Computational Sciences": "01",
    "General ASD Methods without Concrete Object Experiments": "01.04",
    "Physics, Astronomy and Cosmic Sciences": "02",
    "Chemical Sciences": "03",
    "Materials Science": "04",
    "Earth and Environmental Sciences": "05",
    "Life Sciences": "06",
    "Medical and Health Sciences": "07",
    "Agricultural, Food, Forestry, Animal and Fishery Sciences": "08",
    "Engineering and Industrial Technology Sciences": "09",
    "Aerospace, Marine and Transportation Sciences": "10",
    "Social, Behavioral, Economic and Knowledge System Sciences": "11"
  },
  "label_to_secondary_code": {
    "Legacy secondary filing term 01.01": "01.01",
    "Legacy secondary filing term 01.02": "01.02",
    "Legacy secondary filing term 01.03": "01.03",
    "Legacy secondary filing term 01.04": "01.04",
    "Legacy secondary filing term 02.01": "02.01",
    "Legacy secondary filing term 02.02": "02.02",
    "化学总论与化学方法": "03.01",
    "基础化学": "03.02",
    "合成、反应与催化": "03.03",
    "分子设计与化学空间探索": "03.04",
    "材料基础": "04.01",
    "结构材料与无机材料": "04.02",
    "软物质与功能材料": "04.03",
    "能源、电子与器件材料": "04.04",
    "Legacy secondary filing term 05.01": "05.01",
    "Legacy secondary filing term 05.02": "05.02",
    "Legacy secondary filing term 05.03": "05.03",
    "Legacy secondary filing term 05.04": "05.04",
    "生物学基础": "06.01",
    "生物类群科学": "06.02",
    "生物技术相关科学": "06.03",
    "医学基础": "07.01",
    "临床医学": "07.02",
    "公共卫生与健康科学": "07.03",
    "药学与生物医药": "07.04",
    "Legacy secondary filing term 08.01": "08.01",
    "动物科学": "08.03",
    "Legacy secondary filing term 08.05": "08.05",
    "Legacy secondary filing term 09.01": "09.01",
    "Legacy secondary filing term 09.02": "09.02",
    "Legacy secondary filing term 09.03": "09.03",
    "Legacy secondary filing term 09.04": "09.04",
    "Legacy secondary filing term 09.05": "09.05",
    "Legacy secondary filing term 09.06": "09.06",
    "材料与器件工程": "09.08",
    "Legacy secondary filing term 10.02": "10.02",
    "海洋工程": "10.03",
    "Legacy secondary filing term 10.04": "10.04",
    "Legacy secondary filing term 11.01": "11.01",
    "Legacy secondary filing term 11.02": "11.02",
    "Legacy secondary filing term 11.03": "11.03",
    "Legacy secondary filing term 11.04": "11.04",
    "人类学与考古学": "11.06",
    "Legacy secondary filing term 11.07": "11.07",
    "航空科学": "10.01"
  },
  "primary_terms": [
    {
      "primary_code": "01",
      "label": "Formal, Information and Computational Sciences",
      "definition": "Formal, information, computational, mathematical, and systems-science research objects, excluding general ASD method-only records that belong in the separate 01.04 bucket.",
      "include": [
        "formal sciences",
        "information sciences",
        "computational sciences",
        "mathematics",
        "general systems or complexity science with a concrete formal-science object"
      ],
      "exclude": [
        "general ASD method papers without concrete scientific-object experiments",
        "science-system or knowledge-production studies that belong in 11"
      ],
      "status": "active",
      "source": "taxonomy_index.json + long_term_catalog_plan"
    },
    {
      "primary_code": "01.04",
      "label": "General ASD Methods without Concrete Object Experiments",
      "definition": "Separate general-method bucket for ASD / research-agent method papers without concrete scientific-object experiments, validations, benchmark tasks, case studies, or reported results.",
      "include": [
        "general research-agent framework papers without concrete scientific-object validation",
        "general ASD methodology without object-level experiments"
      ],
      "exclude": [
        "any paper with concrete object-level experiments in formal 01-11 modules",
        "formal 01 computational-science research objects"
      ],
      "status": "active",
      "source": "taxonomy_index.json + long_term_catalog_plan"
    },
    {
      "primary_code": "02",
      "label": "Physics, Astronomy and Cosmic Sciences",
      "definition": "Physics, astronomy, astrophysics, cosmology, and cosmic-science research objects.",
      "include": [
        "physics",
        "astronomy",
        "astrophysics",
        "cosmology"
      ],
      "exclude": [
        "materials-science experiments classified under 04",
        "engineering applications classified under 09 or 10"
      ],
      "status": "active",
      "source": "taxonomy_index.json + long_term_catalog_plan"
    },
    {
      "primary_code": "03",
      "label": "Chemical Sciences",
      "definition": "Chemistry and chemical-science research objects.",
      "include": [
        "molecular chemistry",
        "reaction discovery",
        "chemical synthesis",
        "chemical property prediction"
      ],
      "exclude": [
        "materials systems whose primary object is material structure or property",
        "biological assays whose primary object is life science"
      ],
      "status": "active",
      "source": "taxonomy_index.json + long_term_catalog_plan"
    },
    {
      "primary_code": "04",
      "label": "Materials Science",
      "definition": "Materials-science research objects, including material discovery, synthesis, characterization, and properties.",
      "include": [
        "materials discovery",
        "materials synthesis",
        "materials characterization",
        "structure-property relationships"
      ],
      "exclude": [
        "pure chemistry records whose primary object is chemical reaction or molecule",
        "engineering manufacturing systems without materials-science object focus"
      ],
      "status": "active",
      "source": "taxonomy_index.json + long_term_catalog_plan"
    },
    {
      "primary_code": "05",
      "label": "Earth and Environmental Sciences",
      "definition": "Earth, climate, geoscience, ecology, and environmental-science research objects.",
      "include": [
        "earth science",
        "climate science",
        "geoscience",
        "environmental monitoring"
      ],
      "exclude": [
        "agricultural systems classified under 08",
        "social-policy studies classified under 11"
      ],
      "status": "active",
      "source": "taxonomy_index.json + long_term_catalog_plan"
    },
    {
      "primary_code": "06",
      "label": "Life Sciences",
      "definition": "Biological and life-science research objects outside direct clinical medicine.",
      "include": [
        "biology",
        "genomics",
        "protein science",
        "cell biology",
        "systems biology"
      ],
      "exclude": [
        "clinical diagnosis or treatment classified under 07",
        "agricultural biology classified under 08 when the primary object is agricultural production"
      ],
      "status": "active",
      "source": "taxonomy_index.json + long_term_catalog_plan"
    },
    {
      "primary_code": "07",
      "label": "Medical and Health Sciences",
      "definition": "Medicine, clinical health, diagnostics, therapeutics, translational health, and biomedical-care research objects.",
      "include": [
        "clinical medicine",
        "medical diagnosis",
        "drug development with health target",
        "translational bioinformatics"
      ],
      "exclude": [
        "basic life-science mechanism studies without clinical or health target",